title,slug,description,content,quote,category,tags,author,status,meta_title,meta_description,admin_comment
"Complete Guide to Water Purifiers","water-purifier-guide-2026","Everything you need to know about choosing the right water purifier for your home","<h2>Introduction</h2><p>Water purification is essential for maintaining good health...</p><h2>Types of Water Purifiers</h2><p>RO, UV, UF systems explained...</p>","Clean water is the foundation of good health","Product Guide","water purifier,health,guide,RO systems","John Doe","draft","Best Water Purifiers 2026 - Complete Guide","Learn about different types of water purifiers and how to choose the right one for your home. Expert advice and recommendations.","Ready for SEO review"
"Top 10 RO Systems for Home Use","top-ro-systems-2026","Best RO water purification systems with detailed comparison and buying guide","<h2>What is RO?</h2><p>Reverse Osmosis explained...</p><h2>Top 10 Systems</h2><p>Detailed comparison...</p>","Pure water, healthy life - choose wisely","Buying Guide","ro,water purification,home appliances,buying guide","Jane Smith","public","Top 10 RO Systems 2026 | Expert Reviews","Compare the best RO water purification systems for home use. Find the perfect fit for your family's needs.",""
"How to Maintain Your Water Purifier","maintain-water-purifier","Essential maintenance tips to keep your water purifier working efficiently","<h2>Regular Maintenance</h2><p>Filter replacement schedule...</p><h2>Troubleshooting</h2><p>Common issues and solutions...</p>","Regular maintenance ensures clean water always","Product Guide","maintenance,water purifier,tips,DIY","Sarah Johnson","public","Water Purifier Maintenance Guide 2026","Keep your water purifier in perfect condition with our comprehensive maintenance guide. Step-by-step instructions included.","Featured article"
"Health Benefits of Purified Water","health-benefits-purified-water","Discover the amazing health benefits of drinking purified water daily","<h2>Why Purified Water?</h2><p>Health impacts explained...</p><h2>Scientific Studies</h2><p>Research findings...</p>","Your health depends on the water you drink","Health & Wellness","health,wellness,water quality,benefits","Dr. Michael Chen","draft","Amazing Health Benefits of Purified Water","Discover how purified water can improve your health. Backed by scientific research and expert opinions.","Needs medical review"
"Sports Hydration Guide","sports-hydration-complete-guide","The ultimate guide to staying hydrated during sports and exercise","<h2>Importance of Hydration</h2><p>Why athletes need more water...</p><h2>Hydration Strategies</h2><p>Before, during, and after exercise...</p>","Performance starts with proper hydration","Sports Tips","sports,hydration,fitness,athletes,performance","Coach Mark Wilson","public","Sports Hydration Guide | Stay Hydrated, Perform Better","Complete hydration guide for athletes and fitness enthusiasts. Optimize your performance with proper water intake.",""
"Choosing Water Filters for Hard Water","water-filters-hard-water","How to select the right water filter if you have hard water problems","<h2>Understanding Hard Water</h2><p>Mineral content and effects...</p><h2>Best Filters</h2><p>Recommended solutions...</p>","Tackle hard water with the right filter","Buying Guide","hard water,filters,water softener,buying guide","Emily Rodriguez","draft","Best Water Filters for Hard Water 2026","Solve your hard water problems with our expert filter recommendations. Protect your appliances and improve water quality.","Add pricing information"
"Water Quality Testing at Home","home-water-quality-testing","Learn how to test your water quality at home with simple methods and kits","<h2>Why Test Water?</h2><p>Common contaminants...</p><h2>Testing Methods</h2><p>DIY and professional options...</p>","Know what's in your water before you drink it","Product Guide","water testing,quality,safety,DIY,home","James Anderson","public","How to Test Water Quality at Home | Simple Guide","Test your home water quality with our easy-to-follow guide. Ensure your family drinks safe, clean water.","Popular article"
"Best Budget Water Purifiers 2026","budget-water-purifiers-2026","Top affordable water purifiers that don't compromise on quality","<h2>Budget-Friendly Options</h2><p>Quality on a budget...</p><h2>Price Comparison</h2><p>Value for money analysis...</p>","Quality water purification doesn't have to be expensive","Buying Guide","budget,affordable,water purifier,value for money","Lisa Thompson","public","Best Budget Water Purifiers 2026 | Quality Meets Affordability","Find the best affordable water purifiers for your home. Great quality without breaking the bank.","Update prices quarterly"
"Understanding TDS in Water","understanding-tds-water","What is TDS and why it matters for your drinking water quality","<h2>What is TDS?</h2><p>Total Dissolved Solids explained...</p><h2>Ideal TDS Levels</h2><p>Health recommendations...</p>","TDS levels tell you what's really in your water","Product Guide","TDS,water quality,minerals,health standards","Dr. Patricia Lee","draft","Understanding TDS in Water | Complete Guide 2026","Learn about Total Dissolved Solids (TDS) and what they mean for your water quality and health.","Add infographic"
"UV vs RO Water Purifiers","uv-vs-ro-water-purifiers","Comprehensive comparison of UV and RO water purification technologies","<h2>UV Technology</h2><p>How UV purification works...</p><h2>RO Technology</h2><p>Reverse osmosis explained...</p><h2>Comparison</h2><p>Which one is better?</p>","Choose the right technology for your water source","Buying Guide","UV,RO,comparison,technology,purification","David Kumar","public","UV vs RO Water Purifiers | Which is Better for You?","Compare UV and RO water purification technologies. Make an informed decision based on your water source and needs.","Highly rated article"
